{
    "schema_version": "1.0.0",
    "run_id": "018f0000-0000-7000-8000-000000000002",
    "replay_of": null,
    "track": "track-2",
    "trigger": {
        "type": "manual",
        "reference": "authorized-full-run"
    },
    "status": "completed",
    "configuration_digest": "sha256:aaaaaaaaaaaaaaaaaaaaaaaaaaaaaaaaaaaaaaaaaaaaaaaaaaaaaaaaaaaaaaaa",
    "source_registry_digest": null,
    "content_commit": "3333333333333333333333333333333333333333",
    "implementation_commit": "2222222222222222222222222222222222222222",
    "model_role_map_digest": "sha256:cccccccccccccccccccccccccccccccccccccccccccccccccccccccccccccccc",
    "started_at": "2026-08-11T07:00:00Z",
    "completed_at": "2026-08-11T09:00:00Z",
    "actor": {
        "kind": "operator",
        "reference": "authorized-operator"
    },
    "scope": {
        "mode": "full",
        "expected_count": 150,
        "partition_size": 50,
        "concurrency_cap": 4
    },
    "coverage": {
        "expected": 150,
        "enumerated": 150,
        "inspected": 150,
        "gaps": 0
    },
    "item_count": 1,
    "manifest_digest": "sha256:eeeeeeeeeeeeeeeeeeeeeeeeeeeeeeeeeeeeeeeeeeeeeeeeeeeeeeeeeeeeeeee"
}
